{
  "source": "RuneStar/cs2-scripts@7da6c1fba ca_specific_killcount + ca_overview_create_personal helpers",
  "generated": "2026-07-24",
  "excludedTopIndex": 37,
  "tasksCompletedVarbits": [
    12885,
    12886,
    12887,
    12888,
    12889,
    12890
  ],
  "bossKillCountVarps": [
    1502,
    1503,
    1504,
    1505,
    1506,
    1507,
    1508,
    1509,
    1510,
    1511,
    1512,
    1513,
    1514,
    1515,
    1516,
    1517,
    1518,
    1519,
    1520,
    1521,
    1522,
    1523,
    1524,
    1525,
    1526,
    1527,
    1529,
    1585,
    1661,
    1669,
    1691,
    1733,
    2074,
    2075,
    2221,
    2233,
    2353,
    2354,
    2664,
    2671
  ],
  "skillingKillCountVarps": [
    1528,
    2352,
    2934
  ],
  "raidCompletionVarps": [
    1532,
    1748,
    1735,
    3057
  ],
  "killVarps": {
    "1": [
      1526
    ],
    "2": [
      2074
    ],
    "3": [
      1502
    ],
    "4": [
      1733
    ],
    "5": [
      1510
    ],
    "6": [
      1525
    ],
    "7": [
      1513
    ],
    "8": [
      1519
    ],
    "9": [
      1521
    ],
    "10": [
      1532
    ],
    "11": [
      1735
    ],
    "12": [
      1517
    ],
    "13": [
      1505
    ],
    "14": [
      1507
    ],
    "15": [
      1508
    ],
    "16": [
      1509
    ],
    "17": [
      1661
    ],
    "18": [
      2353
    ],
    "19": [
      2354
    ],
    "20": [
      1504
    ],
    "21": [
      1515
    ],
    "22": [
      1669
    ],
    "23": [
      2075
    ],
    "24": [
      1516
    ],
    "25": [
      1514
    ],
    "26": [
      1523
    ],
    "27": [
      1503
    ],
    "28": [
      1506
    ],
    "29": [
      2221
    ],
    "30": [
      2664
    ],
    "31": [
      2671
    ],
    "32": [
      1529
    ],
    "33": [
      2233
    ],
    "34": [
      1520
    ],
    "35": [
      1527
    ],
    "36": [
      2934
    ],
    "37": [
      3058
    ],
    "38": [
      1748
    ],
    "39": [
      3057
    ],
    "40": [
      1524
    ],
    "41": [
      2905,
      2906,
      2907,
      2908,
      2909,
      2910
    ],
    "42": [
      1585
    ],
    "43": [
      1522
    ],
    "44": [
      1511
    ],
    "45": [
      1512
    ],
    "46": [
      1691
    ],
    "47": [
      1528
    ],
    "48": [
      2352
    ],
    "49": [
      1518
    ]
  }
}
